<?xml version="1.0" encoding="UTF-8"?>
<provider_config oid_config_file="src/test/resources/OidConfig.xml" authentication_delay="180" local_id="CSTS-PROVIDER"
	local_password="000102030405060708090a0b0c0d0e0f" max_deadfactor="100"
	max_heartbeat="600" min_deadfactor="2" min_heartbeat="0"
	non_useheartbeat="true" proxy_role="RESPONDER" startup_timer="180"
	transmit_queue_size="10" use_nagel="true"
	xmlns:xsi="http://www.w3.org/2001/XMLSchema-instance"
	xsi:noNamespaceSchemaLocation="ProviderConfig1.xsd" cs_address="5500"
	default_reporting_address="5510" transfer_type="TIMELY">
	<service_types>
	<!-- 
		<service_type srv_id="DUMMY">
			<srv_versions>
				<srv_version sfw="1">1</srv_version>
				<srv_version sfw="2">2</srv_version>
			</srv_versions>
		</service_type>
		<service_type srv_id="MONITORING">
			<srv_versions>
				<srv_version sfw="1">1</srv_version>
				<srv_version sfw="2">2</srv_version>
			</srv_versions>
		</service_type>
 -->
		<!-- Monitored Data Service -->
		<service_type srv_id="[1, 3, 112, 4, 4, 1, 2]">
			<srv_versions>
				<srv_version sfw="1">1</srv_version>
				<srv_version sfw="2">2</srv_version>
			</srv_versions>
		</service_type>

		<!-- Return CFDP PDU Service -->
		<service_type srv_id="[1, 3, 112, 4, 4, 1, 4]">
			<srv_versions>
				<srv_version sfw="1">1</srv_version>
				<srv_version sfw="2">2</srv_version>
			</srv_versions>
		</service_type>

	</service_types>
	<remote_peers>
		<remote_peer authentication_mode="NONE"
			password="ffdf01449809e4e5e677818892" id="CSTS-USER"></remote_peer>
	</remote_peers>
	<local_logical_ports>
	
		<logical_port tcp_recv_buffer_size="4096" port_name="CSTS_PT1"
			tcp_xmit_buffer_size="4096">
			<port_data port_number="5018" ip_address="*" />
		</logical_port>

		<logical_port tcp_recv_buffer_size="4096" port_name="CSTS_PT2"
			tcp_xmit_buffer_size="4096">
			<port_data port_number="5019" ip_address="*" />
		</logical_port>		
		
	</local_logical_ports>
	<portlist default="ISP1"></portlist>
</provider_config>
